{
  "tadId": "TAD-001-001",
  "prdId": "PRD-001",
  "version": "1.0.0",
  "status": "draft",
  "architecturalDecisions": [],
  "generationMetadata": {
    "comprehensiveness": "standard",
    "sectionsGenerated": [
      "systemOverview",
      "architecturePrinciples",
      "extractedConcerns"
    ],
    "totalLlmCalls": 0,
    "totalInputTokens": 0,
    "totalOutputTokens": 0,
    "generatedAt": "2026-06-03T08:07:50Z"
  },
  "partInfo": {
    "partNumber": 1,
    "totalParts": 4,
    "groupId": "overview",
    "groupName": "Overview & Principles",
    "sections": [
      "systemOverview",
      "architecturePrinciples",
      "extractedConcerns"
    ]
  },
  "createdAt": "2026-06-03T08:07:50Z",
  "updatedAt": "2026-06-03T08:07:50Z",
  "extractedConcerns": {
    "sourceDocuments": {
      "prdId": "PRD-001",
      "prdVersion": "1.0.0",
      "userStoriesId": "PRD-001",
      "userStoriesVersion": "1.0.0",
      "extractedAt": "2026-06-03T08:07:50Z"
    },
    "productContext": {
      "productName": "Client Documentation Hub",
      "problemStatement": "WSD authors documentation in Confluence but delivers it to clients as PDFs that are exported, emailed, and version-chased manually for every release. Guest Confluence access and per-client Confluence spaces have been tried and do not scale, producing stale PDFs in client hands, hours of manual distribution work per release, no auditable record of who saw which version, and a split source of truth between Confluence and the latest emailed PDF.",
      "targetUsers": [
        "Client end users (engineers, integrators, operators at WSD client companies) who read product, API, and integration documentation",
        "WSD documentation owners who author and tag pages in Confluence and approve them for publication",
        "WSD release and publishing reviewers who approve AI screening results and AI-generated release notes before they reach clients",
        "Client admins who manage which of their team members can access the client's portal account",
        "WSD security and compliance staff who consume audit logs to demonstrate access control and content review"
      ],
      "scope": {
        "inScope": [
          "Selective sync of approved Confluence pages via configurable label / tag and space allow-list",
          "Approval-state gating: only pages flagged as approved in Confluence are eligible for publication",
          "Near real-time publishing with p95 end-to-end latency under 5 minutes from approval to portal visibility",
          "Immutable per-page version history with at least the last 20 versions retained",
          "Manual sync re-trigger and unpublish actions for doc owners, audit-logged",
          "Secure multi-tenant authentication with password + second factor, optional SAML 2.0 / OIDC SSO",
          "Per-client access scoping with shared and client-specific document visibility",
          "Client-admin role for tenant-level user lifecycle (invite, disable, remove)",
          "Audit log of authentication, document views, and admin actions, retained \u2265 12 months",
          "Browsable portal organised by product and guide category derived from Confluence labels",
          "Per-page version history view with diff against latest",
          "Per-page on-demand PDF generation of any version",
          "Full-text search scoped to the user's entitled documents",
          "Per-user 'last visited' tracking driving AI change-summary feature",
          "Email notifications on documentation changes with configurable cadence (immediate / daily / weekly)",
          "Pre-publish AI document review screening for secrets, internal URLs, Jira links, internal emails, and structurally missing content",
          "Hard block on high-severity AI findings until reviewer confirms false positive or page is corrected",
          "AI-authored release notes (What's New / Breaking Changes / Recommended Actions) with reviewer approval gate",
          "Per-client 'Since your last visit' AI change summary on the portal landing page",
          "AI-generated client notification email summaries, reviewer-approved when breaking",
          "AI documentation quality scoring (completeness / readability / missing examples / missing API responses) as soft warnings",
          "Responsive web portal accessible on modern desktop and tablet browsers"
        ],
        "outOfScope": [
          "Replacing Confluence as the authoring tool",
          "Two-way sync; portal content is read-only relative to Confluence",
          "Public (unauthenticated) documentation pages",
          "In-portal AI chat assistant ('ask the docs') \u2014 Phase 3",
          "Per-client usage analytics dashboards and client-impact analysis \u2014 Phase 3",
          "Authoring or editing documentation from inside the portal",
          "Multilingual translation of documentation; English-only first release",
          "Mobile-native applications; responsive web only",
          "Migration of historical PDF artefacts into the portal's version history",
          "Integration with non-Confluence content sources (Notion, Google Docs, GitHub markdown) for first release",
          "Quality-score trend dashboards beyond a per-page warning surface in v1"
        ]
      }
    },
    "functionalRequirements": [
      {
        "reqId": "REQ-001",
        "title": "Selective Confluence sync via tag / space allow-list",
        "description": "The system shall sync Confluence pages to the portal selectively, driven by a configurable allow-list of Confluence labels / tags and source spaces, so that only intentionally-tagged pages are eligible for publication. The allow-list shall be maintained by a documentation administrator and changes shall take effect on the next sync cycle without requiring a deploy.",
        "category": "Confluence Sync & Publishing",
        "priority": "must",
        "architecturalImplications": []
      },
      {
        "reqId": "REQ-002",
        "title": "Approval-state gating",
        "description": "The system shall only publish pages that are in an 'approved' state, determined by a configurable approval signal in Confluence (label, page status, or workflow state), and shall reject draft / in-review pages from publishing. Pages that lose their approval state after publish shall be unpublished on the next sync.",
        "category": "Confluence Sync & Publishing",
        "priority": "must",
        "architecturalImplications": []
      },
      {
        "reqId": "REQ-003",
        "title": "Near real-time publishing",
        "description": "The system shall detect Confluence page changes and publish updates to the portal in near real-time, with p95 end-to-end latency under 5 minutes from approval to portal visibility. The sync mechanism shall use Confluence change events (webhooks) where available and fall back to polling on a configurable interval.",
        "category": "Confluence Sync & Publishing",
        "priority": "must",
        "architecturalImplications": []
      },
      {
        "reqId": "REQ-004",
        "title": "Per-page version history",
        "description": "The system shall maintain a version history for every published page, retaining at minimum the last 20 versions per page, each with its publish timestamp, source Confluence version ID, and the publisher's identity. Versions shall be immutable once published.",
        "category": "Confluence Sync & Publishing",
        "priority": "must",
        "architecturalImplications": []
      },
      {
        "reqId": "REQ-005",
        "title": "Preserve Confluence page structure on publish",
        "description": "The system shall preserve Confluence page structure on publish: headings, lists, tables, code blocks, inline images, and internal cross-links between published pages. Cross-links to non-published pages shall be rewritten to a clear 'not available' state rather than broken or leaking to Confluence.",
        "category": "Confluence Sync & Publishing",
        "priority": "must",
        "architecturalImplications": []
      },
      {
        "reqId": "REQ-006",
        "title": "Manual sync re-trigger",
        "description": "The system shall allow a documentation owner to manually re-trigger sync of an individual page or a tag set from an admin UI when an automatic sync is suspected to have been missed, with the action audit-logged.",
        "category": "Confluence Sync & Publishing",
        "priority": "should",
        "architecturalImplications": []
      },
      {
        "reqId": "REQ-007",
        "title": "Unpublish without deleting from Confluence",
        "description": "The system shall support unpublishing a page (removal from the portal) without deleting it from Confluence, with an audit-logged reason supplied by the operator. An unpublished page remains in the version history but is not reachable from the portal browse / search.",
        "category": "Confluence Sync & Publishing",
        "priority": "should",
        "architecturalImplications": []
      },
      {
        "reqId": "REQ-010",
        "title": "Authentication required for all portal pages",
        "description": "The system shall require authenticated login for every portal page; no documentation content shall be reachable unauthenticated. Unauthenticated requests shall be redirected to the login flow, preserving the intended destination.",
        "category": "Authentication & Access Control",
        "priority": "must",
        "architecturalImplications": []
      },
      {
        "reqId": "REQ-011",
        "title": "Secure login with second factor",
        "description": "The system shall support a secure login flow with password + second factor (TOTP or email magic link), with industry-standard session handling: HTTP-only Secure cookies, CSRF protection, idempotent logout, configurable session timeout, and brute-force protection (account lockout / rate limiting).",